source_url,page_url,post_id,author,posted_at,heading,text,sentiment_compound,sentiment_label,sentiment_pos,sentiment_neg,sentiment_neu
https://mmb.moneycontrol.com/forum-topics/stocks/alok-industries-2047.html,https://mmb.moneycontrol.com/forum-topics/stocks/alok-industries-2047.html,,,,Alok Industries,Share is down today so we can expect very poor or bad results tomorrow.,0.0,neutral,0.0,0.0,1.0
https://mmb.moneycontrol.com/forum-topics/stocks/alok-industries-2047.html,https://mmb.moneycontrol.com/forum-topics/stocks/alok-industries-2047.html,,,,Alok Industries,promoter only interested in the land of Alok industries company. not interested to get profit to the shareholders. remember it,0.0,neutral,0.0,0.0,1.0
https://mmb.moneycontrol.com/forum-topics/stocks/alok-industries-2047.html,https://mmb.moneycontrol.com/forum-topics/stocks/alok-industries-2047.html,,,,Alok Industries,"Alok Industries ka rating update hua hai, products bhi update hua hai . Share price and balance sheet kab update hogi.",0.0,neutral,0.0,0.0,1.0
https://mmb.moneycontrol.com/forum-topics/stocks/alok-industries-2047.html,https://mmb.moneycontrol.com/forum-topics/stocks/alok-industries-2047.html,,,,Alok Industries,15 january 2026 ko bhi balance sheet mein loss dikha Kar naye tarah se lootega.,0.0,neutral,0.0,0.0,1.0
https://mmb.moneycontrol.com/forum-topics/stocks/alok-industries-2047.html,https://mmb.moneycontrol.com/forum-topics/stocks/alok-industries-2047.html,,,,Alok Industries,"sabhi invester ko buri tarah markar hi Dam lenge , aise galat logo Keval Dan Mei bhi Tax saving karke bhi lootne ka Kam karte hai.",0.0,neutral,0.0,0.0,1.0
https://mmb.moneycontrol.com/forum-topics/stocks/alok-industries-2047.html,https://mmb.moneycontrol.com/forum-topics/stocks/alok-industries-2047.html,,,,Alok Industries,bhai seb jebme hai koi action nahi hoga umid karna murkhata hai lekin sab yahi hai,0.0,neutral,0.0,0.0,1.0
https://mmb.moneycontrol.com/forum-topics/stocks/alok-industries-2047.html,https://mmb.moneycontrol.com/forum-topics/stocks/alok-industries-2047.html,,,,Alok Industries,"ess chu .tiye stock me unnecessary uchhaal aata h or fir vahin aa jata h jahan pahle tha, oprs are manipulating the stock, earning and selling than again buying, sebi should take necessary action...",0.0,neutral,0.0,0.0,1.0
https://mmb.moneycontrol.com/forum-topics/stocks/alok-industries-2047.html,https://mmb.moneycontrol.com/forum-topics/stocks/alok-industries-2047.html,,,,Alok Industries,Bhai sab yahi hai kon saathe leke gaya hai,0.0,neutral,0.0,0.0,1.0
https://mmb.moneycontrol.com/forum-topics/stocks/alok-industries-2047.html,https://mmb.moneycontrol.com/forum-topics/stocks/alok-industries-2047.html,,,,Alok Industries,Something is cooking???? any idea,0.0,neutral,0.0,0.0,1.0
https://mmb.moneycontrol.com/forum-topics/stocks/alok-industries-2047.html,https://mmb.moneycontrol.com/forum-topics/stocks/alok-industries-2047.html,,,,Alok Industries,Bhai dada sab dekhate hai,0.0,neutral,0.0,0.0,1.0
https://mmb.moneycontrol.com/forum-topics/stocks/alok-industries-2047.html,https://mmb.moneycontrol.com/forum-topics/stocks/alok-industries-2047.html,,,,Alok Industries,Mandir janeka jisko bola hai woh ye dekhega nahi or waqt usko dikhayega chhote investor ka khel karne vale ka kya hota hai,0.0,neutral,0.0,0.0,1.0
https://mmb.moneycontrol.com/forum-topics/stocks/alok-industries-2047.html,https://mmb.moneycontrol.com/forum-topics/stocks/alok-industries-2047.html,,,,Alok Industries,khali Mandir Mandir ghumne se kya hogaya jo hona hai hoke rahega ????,0.0,neutral,0.0,0.0,1.0
https://mmb.moneycontrol.com/forum-topics/stocks/alok-industries-2047.html,https://mmb.moneycontrol.com/forum-topics/stocks/alok-industries-2047.html,,,,Alok Industries,a dirty stock is always dirty,0.0,neutral,0.0,0.0,1.0
https://mmb.moneycontrol.com/forum-topics/stocks/alok-industries-2047.html,https://mmb.moneycontrol.com/forum-topics/stocks/alok-industries-2047.html,,,,Alok Industries,vodafone had given the return which will also cross the alok price in near future,0.0,neutral,0.0,0.0,1.0
https://mmb.moneycontrol.com/forum-topics/stocks/alok-industries-2047.html,https://mmb.moneycontrol.com/forum-topics/stocks/alok-industries-2047.html,,,,Alok Industries,it did not give the return to their shareholders who had invested after the takeover by reliance with the hope it have a big name and it will reward but at every purchase it had gone down till now. whole of the money invested eroded. i got the experience that dont wait for the share to go up if does not go up even though it has a big name,0.0,neutral,0.0,0.0,1.0
https://mmb.moneycontrol.com/forum-topics/stocks/alok-industries-2047.html,https://mmb.moneycontrol.com/forum-topics/stocks/alok-industries-2047.html,,,,Alok Industries,Rs. 16.14 crosses Rs. 16.88 may reach,0.0,neutral,0.0,0.0,1.0
https://mmb.moneycontrol.com/forum-topics/stocks/alok-industries-2047.html,https://mmb.moneycontrol.com/forum-topics/stocks/alok-industries-2047.html,,,,Alok Industries,Alok Ind may go to Rs. 19 within few days,0.0,neutral,0.0,0.0,1.0
https://mmb.moneycontrol.com/forum-topics/stocks/alok-industries-2047.html,https://mmb.moneycontrol.com/forum-topics/stocks/alok-industries-2047.html,,,,Alok Industries,better exit and buy other shares. doubt maji will help alok investors.,0.0,neutral,0.0,0.0,1.0
https://mmb.moneycontrol.com/forum-topics/stocks/amara-raja-batt-9625.html,https://mmb.moneycontrol.com/forum-topics/stocks/amara-raja-batt-9625.html,,,,Amara Raja Batt,buy amaraja best stock ever er,0.0,neutral,0.0,0.0,1.0
https://mmb.moneycontrol.com/forum-topics/stocks/amara-raja-batt-9625.html,https://mmb.moneycontrol.com/forum-topics/stocks/amara-raja-batt-9625.html,,,,Amara Raja Batt,never never never.............,0.0,neutral,0.0,0.0,1.0
https://mmb.moneycontrol.com/forum-topics/stocks/amara-raja-batt-9625.html,https://mmb.moneycontrol.com/forum-topics/stocks/amara-raja-batt-9625.html,,,,Bonds,"built with love in india, the fixed income is a sebi registered bond investment platform. it empowers over 2,00,000 investors to grow with stability. whether it’s corporate bonds, government bonds, fixed deposits, or more, our platform helps you build a solid financial foundation with predictable, stable returns. explore now: https://tinyurl.com/fihopa",0.0,neutral,0.0,0.0,1.0
https://mmb.moneycontrol.com/forum-topics/stocks/amara-raja-batt-9625.html,https://mmb.moneycontrol.com/forum-topics/stocks/amara-raja-batt-9625.html,,,,Amara Raja Batt,invest in stocks buy stocks Strong upside in amaraja,0.0,neutral,0.0,0.0,1.0
https://mmb.moneycontrol.com/forum-topics/stocks/amara-raja-batt-9625.html,https://mmb.moneycontrol.com/forum-topics/stocks/amara-raja-batt-9625.html,,,,Amara Raja Batt,buy Feb result ke baad badhega ... gud news,0.0,neutral,0.0,0.0,1.0
https://mmb.moneycontrol.com/forum-topics/stocks/amara-raja-batt-9625.html,https://mmb.moneycontrol.com/forum-topics/stocks/amara-raja-batt-9625.html,,,,Amara Raja Batt,Exit asap... Ola Shakti will cook this sector,0.0,neutral,0.0,0.0,1.0
https://mmb.moneycontrol.com/forum-topics/stocks/amara-raja-batt-9625.html,https://mmb.moneycontrol.com/forum-topics/stocks/amara-raja-batt-9625.html,,,,Amara Raja Batt,hold tight it will boom this year,0.0,neutral,0.0,0.0,1.0
https://mmb.moneycontrol.com/forum-topics/stocks/amara-raja-batt-9625.html,https://mmb.moneycontrol.com/forum-topics/stocks/amara-raja-batt-9625.html,,,,Bonds,"tax efficiency: certain debt instruments, like municipal bonds or government securities, may offer tax benefits. this can help investors optimize their after-tax returns while maintaining a low-risk profile. https://www.thefixedincome.com/products?utm_source=moneycontrol&utm_medium=mcforum&utm_campaign=all+bonds+",0.0,neutral,0.0,0.0,1.0
https://mmb.moneycontrol.com/forum-topics/stocks/amara-raja-batt-9625.html,https://mmb.moneycontrol.com/forum-topics/stocks/amara-raja-batt-9625.html,,,,Amara Raja Batt,dont waste time n money invest kahi aur kare 2027 tak aise hi rahega koi scope nahi hai ...,0.0,neutral,0.0,0.0,1.0
https://mmb.moneycontrol.com/forum-topics/stocks/amara-raja-batt-9625.html,https://mmb.moneycontrol.com/forum-topics/stocks/amara-raja-batt-9625.html,,,,Amara Raja Batt,bhai 1000 share hai kya karo,0.0,neutral,0.0,0.0,1.0
https://mmb.moneycontrol.com/forum-topics/stocks/amara-raja-batt-9625.html,https://mmb.moneycontrol.com/forum-topics/stocks/amara-raja-batt-9625.html,,,,Amara Raja Batt,Good opportunity today value buying investors.,0.0,neutral,0.0,0.0,1.0
https://mmb.moneycontrol.com/forum-topics/stocks/amara-raja-batt-9625.html,https://mmb.moneycontrol.com/forum-topics/stocks/amara-raja-batt-9625.html,,,,Amara Raja Batt,700 around jayega plz sell sellll asap,0.0,neutral,0.0,0.0,1.0
https://mmb.moneycontrol.com/forum-topics/stocks/amara-raja-batt-9625.html,https://mmb.moneycontrol.com/forum-topics/stocks/amara-raja-batt-9625.html,,,,Amara Raja Batt,Bhai hold kro yrr such mai 5000 target hai 2030 tk,0.0,neutral,0.0,0.0,1.0
https://mmb.moneycontrol.com/forum-topics/stocks/amara-raja-batt-9625.html,https://mmb.moneycontrol.com/forum-topics/stocks/amara-raja-batt-9625.html,,,,Bonds,"built with love in india, the fixed income is a sebi registered bond investment platform. it empowers over 2,00,000 investors to grow with stability. whether it’s corporate bonds, government bonds, fixed deposits, or more, our platform helps you build a solid financial foundation with predictable, stable returns. explore now: https://tinyurl.com/fihopa",0.0,neutral,0.0,0.0,1.0
https://mmb.moneycontrol.com/forum-topics/stocks/amara-raja-batt-9625.html,https://mmb.moneycontrol.com/forum-topics/stocks/amara-raja-batt-9625.html,,,,Amara Raja Batt,5000 jayega bhai... dont underestimate the power of this stock,0.0,neutral,0.0,0.0,1.0
https://mmb.moneycontrol.com/forum-topics/stocks/amara-raja-batt-9625.html,https://mmb.moneycontrol.com/forum-topics/stocks/amara-raja-batt-9625.html,,,,Amara Raja Batt,Hold kro bhai upar jaega bhai this year target 1500,0.0,neutral,0.0,0.0,1.0
https://mmb.moneycontrol.com/forum-topics/stocks/amara-raja-batt-9625.html,https://mmb.moneycontrol.com/forum-topics/stocks/amara-raja-batt-9625.html,,,,Amara Raja Batt,"Amara Raja doubling down on building local distribution network in US amid tariffs- Report. The stock has risen more than 3 percent in the past five days, but fell around 2 percent in the past one month. Summary - - Amara Raja aims to double export revenue share in five years - Company expands US presence despite tariff challenges - Shares closed at Rs 930.80, up 3prcnt in five days, but down 19prcnt in one year",0.0,neutral,0.0,0.0,1.0
https://mmb.moneycontrol.com/forum-topics/stocks/amara-raja-batt-9625.html,https://mmb.moneycontrol.com/forum-topics/stocks/amara-raja-batt-9625.html,,,,Amara Raja Batt,Bhai 1000 share hai 1300 price kab tak hold karu,0.0,neutral,0.0,0.0,1.0
https://mmb.moneycontrol.com/forum-topics/stocks/amara-raja-batt-9625.html,https://mmb.moneycontrol.com/forum-topics/stocks/amara-raja-batt-9625.html,,,,Amara Raja Batt,up jayega ya down pure baat bataya kare sir ji,0.0,neutral,0.0,0.0,1.0
https://mmb.moneycontrol.com/forum-topics/stocks/amara-raja-batt-9625.html,https://mmb.moneycontrol.com/forum-topics/stocks/amara-raja-batt-9625.html,,,,Amara Raja Batt,AMARA RAJA COMEBACK SOON ????????????????????????????,0.0,neutral,0.0,0.0,1.0
https://mmb.moneycontrol.com/forum-topics/stocks/amara-raja-batt-9625.html,https://mmb.moneycontrol.com/forum-topics/stocks/amara-raja-batt-9625.html,,,,Amara Raja Batt,This company has lost its mojo and the promoters led BOD basically yes sir people are clueless currently and have no idea what else to do and are biding their time just to make monies for themselves. They have never done anything out of the box for investors wealth creation but have amassed huge wealth for themselves.,0.0,neutral,0.0,0.0,1.0
https://mmb.moneycontrol.com/forum-topics/stocks/apollo-hospital-4161.html,https://mmb.moneycontrol.com/forum-topics/stocks/apollo-hospital-4161.html,,,,Apollo Hospital,"sir wait wait Apollo hospital kings of kings also capacity Cross cross crossed 10,000 before the results maybe cross crossed heavy heavy growth in coming days dont underestimate to capacity Indian rafel once take off then see whats happened",0.0,neutral,0.0,0.0,1.0
https://mmb.moneycontrol.com/forum-topics/stocks/apollo-hospital-4161.html,https://mmb.moneycontrol.com/forum-topics/stocks/apollo-hospital-4161.html,,,,Apollo Hospital,ready ready to New history in coming days dont underestimate to capacity Indian hospital kings of kings Apollo hospital also capacity Cross cross crossed 9000 before the results maybe cross crossed crossed,0.0,neutral,0.0,0.0,1.0
https://mmb.moneycontrol.com/forum-topics/stocks/apollo-hospital-4161.html,https://mmb.moneycontrol.com/forum-topics/stocks/apollo-hospital-4161.html,,,,Bonds,"built with love in india, the fixed income is a sebi registered bond investment platform. it empowers over 2,00,000 investors to grow with stability. whether it’s corporate bonds, government bonds, fixed deposits, or more, our platform helps you build a solid financial foundation with predictable, stable returns. explore now: https://tinyurl.com/fihopa",0.0,neutral,0.0,0.0,1.0
https://mmb.moneycontrol.com/forum-topics/stocks/apollo-hospital-4161.html,https://mmb.moneycontrol.com/forum-topics/stocks/apollo-hospital-4161.html,,,,Apollo Hospital,only ucccc this time around all allegations proved false this time Adani will grow even bigger mark my words for minimum 5ucccccc,0.0,neutral,0.0,0.0,1.0
https://mmb.moneycontrol.com/forum-topics/stocks/apollo-hospital-4161.html,https://mmb.moneycontrol.com/forum-topics/stocks/apollo-hospital-4161.html,,,,Apollo Hospital,sab badiya hai APOLLOHOSP me jab tak retailer bahar nahi niklta ye down hi jata rahega,0.0,neutral,0.0,0.0,1.0
https://mmb.moneycontrol.com/forum-topics/stocks/apollo-hospital-4161.html,https://mmb.moneycontrol.com/forum-topics/stocks/apollo-hospital-4161.html,,,,Apollo Hospital,apollo hospital is recommended in weak market as buy only as defensive stock target is 7300 till budget,0.0,neutral,0.0,0.0,1.0
https://mmb.moneycontrol.com/forum-topics/stocks/apollo-hospital-4161.html,https://mmb.moneycontrol.com/forum-topics/stocks/apollo-hospital-4161.html,,,,Apollo Hospital,Citi on ApolloHospitals High conviction buy target price at 9600 co has attractive valuations shows consistent growth in Hosps and HealthCo It is the cheapest healthcare stock in India offering strong growth trajectory,0.0,neutral,0.0,0.0,1.0
https://mmb.moneycontrol.com/forum-topics/stocks/apollo-hospital-4161.html,https://mmb.moneycontrol.com/forum-topics/stocks/apollo-hospital-4161.html,,,,Bonds,"tax efficiency: certain debt instruments, like municipal bonds or government securities, may offer tax benefits. this can help investors optimize their after-tax returns while maintaining a low-risk profile. https://www.thefixedincome.com/products?utm_source=moneycontrol&utm_medium=mcforum&utm_campaign=all+bonds+",0.0,neutral,0.0,0.0,1.0
https://mmb.moneycontrol.com/forum-topics/stocks/apollo-hospital-4161.html,https://mmb.moneycontrol.com/forum-topics/stocks/apollo-hospital-4161.html,,,,Apollo Hospital,it will recover 10 percentage before expiry on 27th,0.0,neutral,0.0,0.0,1.0
https://mmb.moneycontrol.com/forum-topics/stocks/apollo-hospital-4161.html,https://mmb.moneycontrol.com/forum-topics/stocks/apollo-hospital-4161.html,,,,Apollo Hospital,exit now after other wise it will become 0.5,0.0,neutral,0.0,0.0,1.0
https://mmb.moneycontrol.com/forum-topics/stocks/apollo-hospital-4161.html,https://mmb.moneycontrol.com/forum-topics/stocks/apollo-hospital-4161.html,,,,Apollo Hospital,I have 4 lot of 7350 CE and with price of 22 what to do . Is it possible to gain till 27th Jan,0.0,neutral,0.0,0.0,1.0
https://mmb.moneycontrol.com/forum-topics/stocks/apollo-hospital-4161.html,https://mmb.moneycontrol.com/forum-topics/stocks/apollo-hospital-4161.html,,,,Apollo Hospital,Safe to play in current scenario.. 7500 is immediate target..,0.0,neutral,0.0,0.0,1.0
https://mmb.moneycontrol.com/forum-topics/stocks/apollo-hospital-4161.html,https://mmb.moneycontrol.com/forum-topics/stocks/apollo-hospital-4161.html,,,,Apollo Hospital,worst stock in entire nifty segment stocks. no reason to down trend.,0.0,neutral,0.0,0.0,1.0
https://mmb.moneycontrol.com/forum-topics/stocks/apollo-hospital-4161.html,https://mmb.moneycontrol.com/forum-topics/stocks/apollo-hospital-4161.html,,,,Bonds,"built with love in india, the fixed income is a sebi registered bond investment platform. it empowers over 2,00,000 investors to grow with stability. whether it’s corporate bonds, government bonds, fixed deposits, or more, our platform helps you build a solid financial foundation with predictable, stable returns. explore now: https://tinyurl.com/fihopa",0.0,neutral,0.0,0.0,1.0
https://mmb.moneycontrol.com/forum-topics/stocks/apollo-hospital-4161.html,https://mmb.moneycontrol.com/forum-topics/stocks/apollo-hospital-4161.html,,,,Apollo Hospital,investment it for 9000 in Apollo hospital,0.0,neutral,0.0,0.0,1.0
https://mmb.moneycontrol.com/forum-topics/stocks/apollo-hospital-4161.html,https://mmb.moneycontrol.com/forum-topics/stocks/apollo-hospital-4161.html,,,,Apollo Hospital,Daily breakout found ready to move up to 7500 this week,0.0,neutral,0.0,0.0,1.0
https://mmb.moneycontrol.com/forum-topics/stocks/apollo-hospital-4161.html,https://mmb.moneycontrol.com/forum-topics/stocks/apollo-hospital-4161.html,,,,Apollo Hospital,what is the record date,0.0,neutral,0.0,0.0,1.0
https://mmb.moneycontrol.com/forum-topics/stocks/apollo-hospital-4161.html,https://mmb.moneycontrol.com/forum-topics/stocks/apollo-hospital-4161.html,,,,Apollo Hospital,is demerge share entitlement Record date declared,0.0,neutral,0.0,0.0,1.0
https://mmb.moneycontrol.com/forum-topics/stocks/apollo-hospital-4161.html,https://mmb.moneycontrol.com/forum-topics/stocks/apollo-hospital-4161.html,,,,Apollo Hospital,nifty just 500 points down from 52weeks high and apollo hospital touches 52 weeks low,0.0,neutral,0.0,0.0,1.0
https://mmb.moneycontrol.com/forum-topics/stocks/apollo-hospital-4161.html,https://mmb.moneycontrol.com/forum-topics/stocks/apollo-hospital-4161.html,,,,Apollo Hospital,today due to big players loss for call buyers. just wait for the ending 15 to 30 minutes.,0.0,neutral,0.0,0.0,1.0
https://mmb.moneycontrol.com/forum-topics/stocks/apollo-hospital-4161.html,https://mmb.moneycontrol.com/forum-topics/stocks/apollo-hospital-4161.html,,,,Apollo Hospital,many nifty 50 stocks are going to touch 52 weeks low,0.0,neutral,0.0,0.0,1.0
https://mmb.moneycontrol.com/forum-topics/stocks/apollo-hospital-4161.html,https://mmb.moneycontrol.com/forum-topics/stocks/apollo-hospital-4161.html,,,,Apollo Hospital,Co de merger plan is approved.This will give value creation to shareholders.Great opportunity to buy in long term portfolio,0.0,neutral,0.0,0.0,1.0
https://mmb.moneycontrol.com/forum-topics/stocks/apollo-tyres-9282.html,https://mmb.moneycontrol.com/forum-topics/stocks/apollo-tyres-9282.html,,,,Apollo Tyres,"Domestic demand for tyres across replacement and OEM segments stayed strong in Q3 and should continue in Q4. Export demand remains robust, Europes demand is muted, yet Apollo outperforms. Earnings CAGR of 22 per cent is expected over FY2528",0.0,neutral,0.0,0.0,1.0
https://mmb.moneycontrol.com/forum-topics/stocks/apollo-tyres-9282.html,https://mmb.moneycontrol.com/forum-topics/stocks/apollo-tyres-9282.html,,,,Apollo Tyres,"anytime moov ap tayer ..,.....by by byand hold...............",0.0,neutral,0.0,0.0,1.0
https://mmb.moneycontrol.com/forum-topics/stocks/ashima-22822.html,https://mmb.moneycontrol.com/forum-topics/stocks/ashima-22822.html,,,,Ashima,FIIs increas share holding,0.0,neutral,0.0,0.0,1.0
https://mmb.moneycontrol.com/forum-topics/stocks/ashima-22822.html,https://mmb.moneycontrol.com/forum-topics/stocks/ashima-22822.html,,,,Ashima,"Present market cap comes to near 340 crores, but this bussiness is WAY ABOVE this value, may be five to six times, including land parcels and other assets. so share price has to move up,, may be after ANNUAL AUDITED RESULTS. Lets see what comes up. Have a good day.",0.0,neutral,0.0,0.0,1.0
https://mmb.moneycontrol.com/forum-topics/stocks/ashima-22822.html,https://mmb.moneycontrol.com/forum-topics/stocks/ashima-22822.html,,,,Bonds,"built with love in india, the fixed income is a sebi registered bond investment platform. it empowers over 2,00,000 investors to grow with stability. whether it’s corporate bonds, government bonds, fixed deposits, or more, our platform helps you build a solid financial foundation with predictable, stable returns. explore now: https://tinyurl.com/fihopa",0.0,neutral,0.0,0.0,1.0
https://mmb.moneycontrol.com/forum-topics/stocks/ashima-22822.html,https://mmb.moneycontrol.com/forum-topics/stocks/ashima-22822.html,,,,Ashima,Close abv 23 on monthly basis then new high possible,0.0,neutral,0.0,0.0,1.0
https://mmb.moneycontrol.com/forum-topics/stocks/ashima-22822.html,https://mmb.moneycontrol.com/forum-topics/stocks/ashima-22822.html,,,,Ashima,Shallu Ji Gaurav Ji till you hold Ashima there is a hope for holla and others. One day Ashima will make them super duper rich.,0.0,neutral,0.0,0.0,1.0
https://mmb.moneycontrol.com/forum-topics/stocks/ashima-22822.html,https://mmb.moneycontrol.com/forum-topics/stocks/ashima-22822.html,,,,Ashima,Markets knows better and Shd discount the developments in advance . Waiting for stock to move,0.0,neutral,0.0,0.0,1.0
https://mmb.moneycontrol.com/forum-topics/stocks/ashima-22822.html,https://mmb.moneycontrol.com/forum-topics/stocks/ashima-22822.html,,,,Ashima,"ashima has a lot of stuff build up flats in inventory ready to sell, so two possibilities, they can sell in this quarter and show in dec. ending quarter or they will wait and sell after 31 dec. 2025, to show in last quarter, but after looking 4th quarter ending 31 march 2026, whose results will come near 15 may, we will really know, how their realty business is performing, promoter is very well educated person from abroad, and belongs to very reputed family. now need to see, if he proves aa or ma. have a good day.",0.0,neutral,0.0,0.0,1.0
https://mmb.moneycontrol.com/forum-topics/stocks/ashok-leyland-9001.html,https://mmb.moneycontrol.com/forum-topics/stocks/ashok-leyland-9001.html,,,,Ashok Leyland,"Yes Bank sees ratings upgrades from SMBC stake buy, eyes double-digit loan growth this year, says CEO. Yes Bank expects that the strategic investment by Japans SMBC will help credit ratings upgrades, bring down funding costs and support profitability.",0.0,neutral,0.0,0.0,1.0
https://mmb.moneycontrol.com/forum-topics/stocks/ashok-leyland-9001.html,https://mmb.moneycontrol.com/forum-topics/stocks/ashok-leyland-9001.html,,,,Ashok Leyland,Great Saying - when everyone is feared its good time to buy When everyone is greedy then its time to sell. I normally book half profits at life time high. Kal ho na ho,0.0,neutral,0.0,0.0,1.0
https://mmb.moneycontrol.com/forum-topics/stocks/ashok-leyland-9001.html,https://mmb.moneycontrol.com/forum-topics/stocks/ashok-leyland-9001.html,,,,Bonds,"built with love in india, the fixed income is a sebi registered bond investment platform. it empowers over 2,00,000 investors to grow with stability. whether it’s corporate bonds, government bonds, fixed deposits, or more, our platform helps you build a solid financial foundation with predictable, stable returns. explore now: https://tinyurl.com/fihopa",0.0,neutral,0.0,0.0,1.0
https://mmb.moneycontrol.com/forum-topics/stocks/ashok-leyland-9001.html,https://mmb.moneycontrol.com/forum-topics/stocks/ashok-leyland-9001.html,,,,Ashok Leyland,Wow its New High Profit takers can Buy Tata Steel for more New Highs,0.0,neutral,0.0,0.0,1.0
https://mmb.moneycontrol.com/forum-topics/stocks/ashok-leyland-9001.html,https://mmb.moneycontrol.com/forum-topics/stocks/ashok-leyland-9001.html,,,,Ashok Leyland,market up or down quality stocks will shine and once budget session starts market will give a robust and non stop rally,0.0,neutral,0.0,0.0,1.0
https://mmb.moneycontrol.com/forum-topics/stocks/ashok-leyland-9001.html,https://mmb.moneycontrol.com/forum-topics/stocks/ashok-leyland-9001.html,,,,Ashok Leyland,No need to book profit is there no urgent requirement of money ..picture avi baki hai,0.0,neutral,0.0,0.0,1.0
https://mmb.moneycontrol.com/forum-topics/stocks/ashok-leyland-9001.html,https://mmb.moneycontrol.com/forum-topics/stocks/ashok-leyland-9001.html,,,,Ashok Leyland,Abhi toh picture shuru hua,0.0,neutral,0.0,0.0,1.0
https://mmb.moneycontrol.com/forum-topics/stocks/ashok-leyland-9001.html,https://mmb.moneycontrol.com/forum-topics/stocks/ashok-leyland-9001.html,,,,Bonds,"tax efficiency: certain debt instruments, like municipal bonds or government securities, may offer tax benefits. this can help investors optimize their after-tax returns while maintaining a low-risk profile. https://www.thefixedincome.com/products?utm_source=moneycontrol&utm_medium=mcforum&utm_campaign=all+bonds+",0.0,neutral,0.0,0.0,1.0
https://mmb.moneycontrol.com/forum-topics/stocks/ashok-leyland-9001.html,https://mmb.moneycontrol.com/forum-topics/stocks/ashok-leyland-9001.html,,,,Ashok Leyland,tata ke baad commercial vehicles mai no 2 par hai,0.0,neutral,0.0,0.0,1.0
https://mmb.moneycontrol.com/forum-topics/stocks/ashok-leyland-9001.html,https://mmb.moneycontrol.com/forum-topics/stocks/ashok-leyland-9001.html,,,,Ashok Leyland,exactly..Ashokleyland after a long time showing the strong strength Jai ho,0.0,neutral,0.0,0.0,1.0
https://mmb.moneycontrol.com/forum-topics/stocks/ashok-leyland-9001.html,https://mmb.moneycontrol.com/forum-topics/stocks/ashok-leyland-9001.html,,,,Ashok Leyland,deserve this move 200 very soon,0.0,neutral,0.0,0.0,1.0
