source_url,page_url,post_id,author,posted_at,heading,text,sentiment_compound,sentiment_label,sentiment_pos,sentiment_neg,sentiment_neu
https://mmb.moneycontrol.com/forum-topics/stocks/ashok-leyland-9001.html,https://mmb.moneycontrol.com/forum-topics/stocks/ashok-leyland-9001.html,,,,Ashok Leyland,Ashok Leyland Ltd will consistently catch the upwards by March and beyond with occasional short spikes towards Rs 220 and Rs 260 marks. Patience for the long term gains is needed. Short term gainers will miss the Bus.,0.0,neutral,0.0,0.0,1.0
https://mmb.moneycontrol.com/forum-topics/stocks/ashok-leyland-9001.html,https://mmb.moneycontrol.com/forum-topics/stocks/ashok-leyland-9001.html,,,,Ashok Leyland,Its stucking around 190 in this month. Lets see how it goes tomorrow.,0.0,neutral,0.0,0.0,1.0
https://mmb.moneycontrol.com/forum-topics/stocks/ashok-leyland-9001.html,https://mmb.moneycontrol.com/forum-topics/stocks/ashok-leyland-9001.html,,,,Bonds,"built with love in india, the fixed income is a sebi registered bond investment platform. it empowers over 2,00,000 investors to grow with stability. whether it’s corporate bonds, government bonds, fixed deposits, or more, our platform helps you build a solid financial foundation with predictable, stable returns. explore now: https://tinyurl.com/fihopa",0.0,neutral,0.0,0.0,1.0
https://mmb.moneycontrol.com/forum-topics/stocks/ashok-leyland-9001.html,https://mmb.moneycontrol.com/forum-topics/stocks/ashok-leyland-9001.html,,,,Ashok Leyland,As i said in the morning AL has strong potential to cross 200 levels and the best in the automobile sector. Must add for long term .,0.0,neutral,0.0,0.0,1.0
https://mmb.moneycontrol.com/forum-topics/stocks/ashok-leyland-9001.html,https://mmb.moneycontrol.com/forum-topics/stocks/ashok-leyland-9001.html,,,,Ashok Leyland,Results are expected to be great wait for one month minimum 225 on the track,0.0,neutral,0.0,0.0,1.0
https://mmb.moneycontrol.com/forum-topics/stocks/ashok-leyland-9001.html,https://mmb.moneycontrol.com/forum-topics/stocks/ashok-leyland-9001.html,,,,Ashok Leyland,52 week high coming target 195,0.0,neutral,0.0,0.0,1.0
https://mmb.moneycontrol.com/forum-topics/stocks/ashok-leyland-9001.html,https://mmb.moneycontrol.com/forum-topics/stocks/ashok-leyland-9001.html,,,,Ashok Leyland,Ashok gave Lund to you,0.0,neutral,0.0,0.0,1.0
https://mmb.moneycontrol.com/forum-topics/stocks/ashok-leyland-9001.html,https://mmb.moneycontrol.com/forum-topics/stocks/ashok-leyland-9001.html,,,,Ashok Leyland,"Despite market heavy sell off, AL is showing strength and if market support it will cross 200 plus levels soon.",0.0,neutral,0.0,0.0,1.0
https://mmb.moneycontrol.com/forum-topics/stocks/ashok-leyland-9001.html,https://mmb.moneycontrol.com/forum-topics/stocks/ashok-leyland-9001.html,,,,Ashok Leyland,If market will positive then will touch 190 todays,0.0,neutral,0.0,0.0,1.0
https://mmb.moneycontrol.com/forum-topics/stocks/ashok-leyland-9001.html,https://mmb.moneycontrol.com/forum-topics/stocks/ashok-leyland-9001.html,,,,Ashok Leyland,YOU WILL GET IT AT LEY LUND PRICE AT OPENING ITSELF,0.0,neutral,0.0,0.0,1.0
https://mmb.moneycontrol.com/forum-topics/stocks/ashok-leyland-9001.html,https://mmb.moneycontrol.com/forum-topics/stocks/ashok-leyland-9001.html,,,,Ashok Leyland,should go 185.6 if open in green,0.0,neutral,0.0,0.0,1.0
https://mmb.moneycontrol.com/forum-topics/stocks/ashok-leyland-9001.html,https://mmb.moneycontrol.com/forum-topics/stocks/ashok-leyland-9001.html,,,,Ashok Leyland,any target for ashok leyland,0.0,neutral,0.0,0.0,1.0
https://mmb.moneycontrol.com/forum-topics/stocks/ashok-leyland-9001.html,https://mmb.moneycontrol.com/forum-topics/stocks/ashok-leyland-9001.html,,,,Ashok Leyland,175 to 176 levels are best for buying,0.0,neutral,0.0,0.0,1.0
https://mmb.moneycontrol.com/forum-topics/stocks/ashok-leyland-9001.html,https://mmb.moneycontrol.com/forum-topics/stocks/ashok-leyland-9001.html,,,,Ashok Leyland,Well.. Already shared downside.,0.0,neutral,0.0,0.0,1.0
https://mmb.moneycontrol.com/forum-topics/stocks/ashok-leyland-9001.html,https://mmb.moneycontrol.com/forum-topics/stocks/ashok-leyland-9001.html,,,,Ashok Leyland,"super breakout done, 200 coming soon",0.0,neutral,0.0,0.0,1.0
https://mmb.moneycontrol.com/forum-topics/stocks/ashok-leyland-9001.html,https://mmb.moneycontrol.com/forum-topics/stocks/ashok-leyland-9001.html,,,,Ashok Leyland,it will not stop company is expanding and growing fair value is 250 plus,0.0,neutral,0.0,0.0,1.0
https://mmb.moneycontrol.com/forum-topics/stocks/ashok-leyland-9001.html,https://mmb.moneycontrol.com/forum-topics/stocks/ashok-leyland-9001.html,,,,Ashok Leyland,Input costs are increasing due to all time high metal index. It should correct towards 170 level soon.,0.0,neutral,0.0,0.0,1.0
https://mmb.moneycontrol.com/forum-topics/stocks/ashok-leyland-9001.html,https://mmb.moneycontrol.com/forum-topics/stocks/ashok-leyland-9001.html,,,,Ashok Leyland,suggested at 100 for tgt 260 excellent going,0.0,neutral,0.0,0.0,1.0
https://mmb.moneycontrol.com/forum-topics/stocks/ashok-leyland-9001.html,https://mmb.moneycontrol.com/forum-topics/stocks/ashok-leyland-9001.html,,,,Ashok Leyland,ashok leyland will double in next 2 years buy buy buy buy buy buy buy buy buy buy,0.0,neutral,0.0,0.0,1.0
https://mmb.moneycontrol.com/forum-topics/stocks/ashok-leyland-9001.html,https://mmb.moneycontrol.com/forum-topics/stocks/ashok-leyland-9001.html,,,,Ashok Leyland,why it is falling today even when it opened its manufacturing unit in up,0.0,neutral,0.0,0.0,1.0
https://mmb.moneycontrol.com/forum-topics/stocks/ashok-leyland-9001.html,https://mmb.moneycontrol.com/forum-topics/stocks/ashok-leyland-9001.html,,,,Ashok Leyland,"Ashok Leyland enters UP with first e-bus plant, bets Rs 1,000 crore on Lucknow manufacturing hub. Built over nearly 70 acres in a record 16 months, the facility marks Uttar Pradeshs first dedicated e-bus manufacturing unit. In the initial phase, the plant has an annual production capacity of 2,500 vehicles. The new plant was inaugurated by Defence Minister Rajnath Singh in the presence of Chief Minister Yogi Adityanath and Union Heavy Industries Minister H D Kumaraswamy. Summary - - Ashok Leyland opens first electric bus plant in Lucknow, UP - Facility has initial capacity of 2,500 vehicles, expandable to 5,000 per year - Plant earns IGBC Platinum rating, uses solar power, and advanced sustainability measures",0.0,neutral,0.0,0.0,1.0
https://mmb.moneycontrol.com/forum-topics/stocks/ashok-leyland-9001.html,https://mmb.moneycontrol.com/forum-topics/stocks/ashok-leyland-9001.html,,,,Ashok Leyland,Company growth rise by 28 percent month wise . No one can’t stop this Gem,0.0,neutral,0.0,0.0,1.0
https://mmb.moneycontrol.com/forum-topics/stocks/ashok-leyland-9001.html,https://mmb.moneycontrol.com/forum-topics/stocks/ashok-leyland-9001.html,,,,Ashok Leyland,huge manipulation in is is only going high n high...,0.0,neutral,0.0,0.0,1.0
https://mmb.moneycontrol.com/forum-topics/stocks/ashok-leyland-9001.html,https://mmb.moneycontrol.com/forum-topics/stocks/ashok-leyland-9001.html,,,,Ashok Leyland,buy buy buy ashok lynd for more new highs,0.0,neutral,0.0,0.0,1.0
https://mmb.moneycontrol.com/forum-topics/stocks/ashok-leyland-9001.html,https://mmb.moneycontrol.com/forum-topics/stocks/ashok-leyland-9001.html,,,,Ashok Leyland,today bullish day for ashok lynd buy for 190,0.0,neutral,0.0,0.0,1.0
https://mmb.moneycontrol.com/forum-topics/stocks/ashok-leyland-9001.html,https://mmb.moneycontrol.com/forum-topics/stocks/ashok-leyland-9001.html,,,,Ashok Leyland,184 is the last it can go sales number are awesome from last 2 months which reflects the result . it can definitely go 215 jan end,0.0,neutral,0.0,0.0,1.0
https://mmb.moneycontrol.com/forum-topics/stocks/ashok-leyland-9001.html,https://mmb.moneycontrol.com/forum-topics/stocks/ashok-leyland-9001.html,,,,Ashok Leyland,Correction may be increase in this counter,0.0,neutral,0.0,0.0,1.0
https://mmb.moneycontrol.com/forum-topics/stocks/ashok-leyland-9001.html,https://mmb.moneycontrol.com/forum-topics/stocks/ashok-leyland-9001.html,,,,Ashok Leyland,Buy now at CMP and add on every dip. At the beginning of this series fno price at 4 point discount and now sink to less then a rupee. big blast on this script on short covering followed byfresh long position before q3 earning results. target for this series is 220 levels,0.0,neutral,0.0,0.0,1.0
https://mmb.moneycontrol.com/forum-topics/stocks/ashok-leyland-9001.html,https://mmb.moneycontrol.com/forum-topics/stocks/ashok-leyland-9001.html,,,,Ashok Leyland,correction may be upto 182,0.0,neutral,0.0,0.0,1.0
https://mmb.moneycontrol.com/forum-topics/stocks/ashok-leyland-9001.html,https://mmb.moneycontrol.com/forum-topics/stocks/ashok-leyland-9001.html,,,,Ashok Leyland,Today it will cross again 190 in starting 30 mins,0.0,neutral,0.0,0.0,1.0
https://mmb.moneycontrol.com/forum-topics/stocks/ashok-leyland-9001.html,https://mmb.moneycontrol.com/forum-topics/stocks/ashok-leyland-9001.html,,,,Ashok Leyland,1.5 million shares of Ashok Leyland traded in a block- Bloomberg,0.0,neutral,0.0,0.0,1.0
https://mmb.moneycontrol.com/forum-topics/stocks/ashok-leyland-9001.html,https://mmb.moneycontrol.com/forum-topics/stocks/ashok-leyland-9001.html,,,,Ashok Leyland,due to global circumstances may go down below 185 level,0.0,neutral,0.0,0.0,1.0
https://mmb.moneycontrol.com/forum-topics/stocks/ashok-leyland-9001.html,https://mmb.moneycontrol.com/forum-topics/stocks/ashok-leyland-9001.html,,,,Ashok Leyland,buy buy immediately 195 its a trap by shorters.,0.0,neutral,0.0,0.0,1.0
https://mmb.moneycontrol.com/forum-topics/stocks/ashok-leyland-9001.html,https://mmb.moneycontrol.com/forum-topics/stocks/ashok-leyland-9001.html,,,,Ashok Leyland,Healthy correction if come to 185 definitely a buy,0.0,neutral,0.0,0.0,1.0
https://mmb.moneycontrol.com/forum-topics/stocks/ashok-leyland-9001.html,https://mmb.moneycontrol.com/forum-topics/stocks/ashok-leyland-9001.html,,,,Ashok Leyland,started correction on this counter,0.0,neutral,0.0,0.0,1.0
https://mmb.moneycontrol.com/forum-topics/stocks/ashok-leyland-9001.html,https://mmb.moneycontrol.com/forum-topics/stocks/ashok-leyland-9001.html,,,,Ashok Leyland,ab bhi chance he buy karne ka traget Rs. 200 4 days,0.0,neutral,0.0,0.0,1.0
https://mmb.moneycontrol.com/forum-topics/stocks/ashok-leyland-9001.html,https://mmb.moneycontrol.com/forum-topics/stocks/ashok-leyland-9001.html,,,,Ashok Leyland,heading towards 220 sharply raise your bets on delivery,0.0,neutral,0.0,0.0,1.0
https://mmb.moneycontrol.com/forum-topics/stocks/ashok-leyland-9001.html,https://mmb.moneycontrol.com/forum-topics/stocks/ashok-leyland-9001.html,,,,Ashok Leyland,yes it may be down and correction to 183,0.0,neutral,0.0,0.0,1.0
https://mmb.moneycontrol.com/forum-topics/stocks/ashok-leyland-9001.html,https://mmb.moneycontrol.com/forum-topics/stocks/ashok-leyland-9001.html,,,,Ashok Leyland,correction may be next trading days,0.0,neutral,0.0,0.0,1.0
https://mmb.moneycontrol.com/forum-topics/stocks/ashok-leyland-9001.html,https://mmb.moneycontrol.com/forum-topics/stocks/ashok-leyland-9001.html,,,,Ashok Leyland,may down 2 percent on monday,0.0,neutral,0.0,0.0,1.0
https://mmb.moneycontrol.com/forum-topics/stocks/ashok-leyland-9001.html,https://mmb.moneycontrol.com/forum-topics/stocks/ashok-leyland-9001.html,,,,Ashok Leyland,the movement in ashok leyland gives the indicaton that 200 is possible next week itself,0.0,neutral,0.0,0.0,1.0
https://mmb.moneycontrol.com/forum-topics/stocks/ashok-leyland-9001.html,https://mmb.moneycontrol.com/forum-topics/stocks/ashok-leyland-9001.html,,,,Ashok Leyland,"Hold with convincingly, rally continue till 200 plus . Trend is bullish only.",0.0,neutral,0.0,0.0,1.0
https://mmb.moneycontrol.com/forum-topics/stocks/ashok-leyland-9001.html,https://mmb.moneycontrol.com/forum-topics/stocks/ashok-leyland-9001.html,,,,Ashok Leyland,let us see how it reacts next week,0.0,neutral,0.0,0.0,1.0
https://mmb.moneycontrol.com/forum-topics/stocks/ashok-leyland-9001.html,https://mmb.moneycontrol.com/forum-topics/stocks/ashok-leyland-9001.html,,,,Ashok Leyland,it should cross 210 before 3 quarter results. my opinion,0.0,neutral,0.0,0.0,1.0
https://mmb.moneycontrol.com/forum-topics/stocks/ashok-leyland-9001.html,https://mmb.moneycontrol.com/forum-topics/stocks/ashok-leyland-9001.html,,,,Ashok Leyland,Before April 2026 it will touch 230 as you prefer buy as much to achieve the profit,0.0,neutral,0.0,0.0,1.0
https://mmb.moneycontrol.com/forum-topics/stocks/ashok-leyland-9001.html,https://mmb.moneycontrol.com/forum-topics/stocks/ashok-leyland-9001.html,,,,Ashok Leyland,what is the time frame by which you think we will achieve the target of 230,0.0,neutral,0.0,0.0,1.0
https://mmb.moneycontrol.com/forum-topics/stocks/ashok-leyland-9001.html,https://mmb.moneycontrol.com/forum-topics/stocks/ashok-leyland-9001.html,,,,Ashok Leyland,Should cross 200 by March. Hold.,0.0,neutral,0.0,0.0,1.0
https://mmb.moneycontrol.com/forum-topics/stocks/ashok-leyland-9001.html,https://mmb.moneycontrol.com/forum-topics/stocks/ashok-leyland-9001.html,,,,Ashok Leyland,"Ashok Leyland total sales up 27prcnt in December at 21,533 units versus 16,957 units, YoY",0.0,neutral,0.0,0.0,1.0
https://mmb.moneycontrol.com/forum-topics/stocks/ashok-leyland-9001.html,https://mmb.moneycontrol.com/forum-topics/stocks/ashok-leyland-9001.html,,,,Ashok Leyland,"Indus Towers, Ashok Leyland, Adani Energy, among others hit 52-week Towers, Ashok Leyland, Adani Energy, among others hit 52-week high",0.0,neutral,0.0,0.0,1.0
https://mmb.moneycontrol.com/forum-topics/stocks/ashok-leyland-9001.html,https://mmb.moneycontrol.com/forum-topics/stocks/ashok-leyland-9001.html,,,,Ashok Leyland,"As mentioned yesterday, 185 milestone has been achieved.. Aiming for 200 in this series..",0.0,neutral,0.0,0.0,1.0
https://mmb.moneycontrol.com/forum-topics/stocks/ashok-leyland-9001.html,https://mmb.moneycontrol.com/forum-topics/stocks/ashok-leyland-9001.html,,,,Ashok Leyland,190 coming in month hold it or 200 also can reach,0.0,neutral,0.0,0.0,1.0
https://mmb.moneycontrol.com/forum-topics/stocks/ashok-leyland-9001.html,https://mmb.moneycontrol.com/forum-topics/stocks/ashok-leyland-9001.html,,,,Ashok Leyland,As expected today ashok Leyland moved up by 2 percent plus and is moving towards the 200 mark buy for 240 target for the year 2026 which is 20 percent returns for yea6,0.0,neutral,0.0,0.0,1.0
https://mmb.moneycontrol.com/forum-topics/stocks/ashok-leyland-9001.html,https://mmb.moneycontrol.com/forum-topics/stocks/ashok-leyland-9001.html,,,,Ashok Leyland,ashok leyland market cap just waiting to explode. just waiting for some big fpi to take substantial stake. 20 percent yoy growth in the next ten years would be an understatement. market cap 5 lac crore in one year,0.0,neutral,0.0,0.0,1.0
https://mmb.moneycontrol.com/forum-topics/stocks/ashok-leyland-9001.html,https://mmb.moneycontrol.com/forum-topics/stocks/ashok-leyland-9001.html,,,,Ashok Leyland,"Tomorrow auto sales numbers will decide path.. 180 looks resistance. If it breaks 180, it will march towards 200",0.0,neutral,0.0,0.0,1.0
https://mmb.moneycontrol.com/forum-topics/stocks/ashok-leyland-9001.html,https://mmb.moneycontrol.com/forum-topics/stocks/ashok-leyland-9001.html,,,,Ashok Leyland,short ka sab target 200 de rahe hai aur ye 180 par kar nhi pa raha hai pahle 180 par kar ke dikhaye ours market green par ye wahi ka wahi hai bekar,0.0,neutral,0.0,0.0,1.0
https://mmb.moneycontrol.com/forum-topics/stocks/ashok-leyland-9001.html,https://mmb.moneycontrol.com/forum-topics/stocks/ashok-leyland-9001.html,,,,Ashok Leyland,short built up in futures,0.0,neutral,0.0,0.0,1.0
https://mmb.moneycontrol.com/forum-topics/stocks/ashok-leyland-9001.html,https://mmb.moneycontrol.com/forum-topics/stocks/ashok-leyland-9001.html,,,,Ashok Leyland,buy ashok leyland short term target Rs. 200,0.0,neutral,0.0,0.0,1.0
https://mmb.moneycontrol.com/forum-topics/stocks/ashok-leyland-9001.html,https://mmb.moneycontrol.com/forum-topics/stocks/ashok-leyland-9001.html,,,,Ashok Leyland,buy target 230 in ashok leyland soon,0.0,neutral,0.0,0.0,1.0
https://mmb.moneycontrol.com/forum-topics/stocks/ashok-leyland-9001.html,https://mmb.moneycontrol.com/forum-topics/stocks/ashok-leyland-9001.html,,,,Ashok Leyland,"Ashok Leyland, Maruti Suzuki, PTC Industries, among others hit 52-week high",0.0,neutral,0.0,0.0,1.0
https://mmb.moneycontrol.com/forum-topics/stocks/ashok-leyland-9001.html,https://mmb.moneycontrol.com/forum-topics/stocks/ashok-leyland-9001.html,,,,Ashok Leyland,Will touch 184 by tomorrow ???? Sure,0.0,neutral,0.0,0.0,1.0
https://mmb.moneycontrol.com/forum-topics/stocks/ashok-leyland-9001.html,https://mmb.moneycontrol.com/forum-topics/stocks/ashok-leyland-9001.html,,,,Ashok Leyland,finally AL in the territory where no one can stop it. with strong set of numbers now sky will be the limit. keep holding.,0.0,neutral,0.0,0.0,1.0
https://mmb.moneycontrol.com/forum-topics/stocks/ashok-leyland-9001.html,https://mmb.moneycontrol.com/forum-topics/stocks/ashok-leyland-9001.html,,,,Ashok Leyland,Ashok Leyland has been consistently improving margins and increasing market share. If this continues then we can expect it to cross 200 levels.,0.0,neutral,0.0,0.0,1.0
https://mmb.moneycontrol.com/forum-topics/stocks/ashok-leyland-9001.html,https://mmb.moneycontrol.com/forum-topics/stocks/ashok-leyland-9001.html,,,,Ashok Leyland,strong resistance at 178.30 levels just crossed above and breaks with heavy volume then moving towards double century fews this script side ways now starting to blast to 200 levels,0.0,neutral,0.0,0.0,1.0
https://mmb.moneycontrol.com/forum-topics/stocks/ashok-leyland-9001.html,https://mmb.moneycontrol.com/forum-topics/stocks/ashok-leyland-9001.html,,,,Ashok Leyland,numbers are excellent . 2026 is rocking for ashok leyland .,0.0,neutral,0.0,0.0,1.0
https://mmb.moneycontrol.com/forum-topics/stocks/ashok-leyland-9001.html,https://mmb.moneycontrol.com/forum-topics/stocks/ashok-leyland-9001.html,,,,Ashok Leyland,AL is now entering in the phase where technicals will only work. ATH coming by 12 noon..,0.0,neutral,0.0,0.0,1.0
https://mmb.moneycontrol.com/forum-topics/stocks/ashok-leyland-9001.html,https://mmb.moneycontrol.com/forum-topics/stocks/ashok-leyland-9001.html,,,,Ashok Leyland,"its just a matter of time this will come to 150 level valuation is just crazy in an extremely overbought territory daily,weekly,monthly",0.0,neutral,0.0,0.0,1.0
https://mmb.moneycontrol.com/forum-topics/stocks/asian-paints-262.html,https://mmb.moneycontrol.com/forum-topics/stocks/asian-paints-262.html,,,,Asian Paints,Risk stays controlled at this level. Failure would mean staying on the sidelines,0.0,neutral,0.0,0.0,1.0
https://mmb.moneycontrol.com/forum-topics/stocks/asian-paints-262.html,https://mmb.moneycontrol.com/forum-topics/stocks/asian-paints-262.html,,,,Asian Paints,Results is subdued on all front and quick trade on sell side just in 2 minutes made our super duper afternoon.,0.0,neutral,0.0,0.0,1.0
https://mmb.moneycontrol.com/forum-topics/stocks/asian-paints-262.html,https://mmb.moneycontrol.com/forum-topics/stocks/asian-paints-262.html,,,,Bonds,"built with love in india, the fixed income is a sebi registered bond investment platform. it empowers over 2,00,000 investors to grow with stability. whether it’s corporate bonds, government bonds, fixed deposits, or more, our platform helps you build a solid financial foundation with predictable, stable returns. explore now: https://tinyurl.com/fihopa",0.0,neutral,0.0,0.0,1.0
https://mmb.moneycontrol.com/forum-topics/stocks/asian-paints-262.html,https://mmb.moneycontrol.com/forum-topics/stocks/asian-paints-262.html,,,,Asian Paints,ab share ko chindi profit ke liye sell mat karo within twonday govt will announce big relief then 14 hoga dont sell jan huge loss main the to sell nahi kar rahe the ab profit main ho to big profit lo why sell 9 rs se niche nahi jayega max 9 upar 20 hoga,0.0,neutral,0.0,0.0,1.0
https://mmb.moneycontrol.com/forum-topics/stocks/asian-paints-262.html,https://mmb.moneycontrol.com/forum-topics/stocks/asian-paints-262.html,,,,Asian Paints,results will go down 3 to 5 percent,0.0,neutral,0.0,0.0,1.0
https://mmb.moneycontrol.com/forum-topics/stocks/asian-paints-262.html,https://mmb.moneycontrol.com/forum-topics/stocks/asian-paints-262.html,,,,Asian Paints,Volume is picking up after a tight phase. Need to see if participation sustains,0.0,neutral,0.0,0.0,1.0
https://mmb.moneycontrol.com/forum-topics/stocks/asian-paints-262.html,https://mmb.moneycontrol.com/forum-topics/stocks/asian-paints-262.html,,,,Asian Paints,Results will be good tomorrow gap up,0.0,neutral,0.0,0.0,1.0
https://mmb.moneycontrol.com/forum-topics/stocks/asian-paints-262.html,https://mmb.moneycontrol.com/forum-topics/stocks/asian-paints-262.html,,,,Bonds,"tax efficiency: certain debt instruments, like municipal bonds or government securities, may offer tax benefits. this can help investors optimize their after-tax returns while maintaining a low-risk profile. https://www.thefixedincome.com/products?utm_source=moneycontrol&utm_medium=mcforum&utm_campaign=all+bonds+",0.0,neutral,0.0,0.0,1.0
https://mmb.moneycontrol.com/forum-topics/stocks/asian-paints-262.html,https://mmb.moneycontrol.com/forum-topics/stocks/asian-paints-262.html,,,,Asian Paints,results are expecting trade will again touch 2600 levels if so.,0.0,neutral,0.0,0.0,1.0
https://mmb.moneycontrol.com/forum-topics/stocks/asian-paints-262.html,https://mmb.moneycontrol.com/forum-topics/stocks/asian-paints-262.html,,,,Asian Paints,result time after market hours,0.0,neutral,0.0,0.0,1.0
https://mmb.moneycontrol.com/forum-topics/stocks/asian-paints-262.html,https://mmb.moneycontrol.com/forum-topics/stocks/asian-paints-262.html,,,,Asian Paints,AP will move towards 3300 from now onwards for sure,0.0,neutral,0.0,0.0,1.0
https://mmb.moneycontrol.com/forum-topics/stocks/asian-paints-262.html,https://mmb.moneycontrol.com/forum-topics/stocks/asian-paints-262.html,,,,Asian Paints,byu asian paint2700 and stop2610 for target of3360,0.0,neutral,0.0,0.0,1.0
https://mmb.moneycontrol.com/forum-topics/stocks/asian-paints-262.html,https://mmb.moneycontrol.com/forum-topics/stocks/asian-paints-262.html,,,,Asian Paints,Hope it touches 2800 today,0.0,neutral,0.0,0.0,1.0
https://mmb.moneycontrol.com/forum-topics/stocks/asian-paints-262.html,https://mmb.moneycontrol.com/forum-topics/stocks/asian-paints-262.html,,,,Bonds,"built with love in india, the fixed income is a sebi registered bond investment platform. it empowers over 2,00,000 investors to grow with stability. whether it’s corporate bonds, government bonds, fixed deposits, or more, our platform helps you build a solid financial foundation with predictable, stable returns. explore now: https://tinyurl.com/fihopa",0.0,neutral,0.0,0.0,1.0
https://mmb.moneycontrol.com/forum-topics/stocks/asian-paints-262.html,https://mmb.moneycontrol.com/forum-topics/stocks/asian-paints-262.html,,,,Asian Paints,Good price to buy this stock,0.0,neutral,0.0,0.0,1.0
https://mmb.moneycontrol.com/forum-topics/stocks/asian-paints-262.html,https://mmb.moneycontrol.com/forum-topics/stocks/asian-paints-262.html,,,,Asian Paints,"the company had entered into the business of manufacturing and exporting white cement and white cement clinker by setting up a manufacturing facility in fujairah, united arab emirates through a joint venture company, asian white cement holding limited , in partnership with rs holdings limited and others u.a.e. and associated soap stone distributing company private limited , india",0.0,neutral,0.0,0.0,1.0
https://mmb.moneycontrol.com/forum-topics/stocks/asian-paints-262.html,https://mmb.moneycontrol.com/forum-topics/stocks/asian-paints-262.html,,,,Asian Paints,asian paints will publish very good result in this quarter target after result 3300 buy for short term good returns.,0.0,neutral,0.0,0.0,1.0
https://mmb.moneycontrol.com/forum-topics/stocks/asian-paints-262.html,https://mmb.moneycontrol.com/forum-topics/stocks/asian-paints-262.html,,,,Asian Paints,Thank you for the information,0.0,neutral,0.0,0.0,1.0
https://mmb.moneycontrol.com/forum-topics/stocks/asian-paints-262.html,https://mmb.moneycontrol.com/forum-topics/stocks/asian-paints-262.html,,,,Asian Paints,on 27 Jan 2026 result will be announced,0.0,neutral,0.0,0.0,1.0
https://mmb.moneycontrol.com/forum-topics/stocks/asian-paints-262.html,https://mmb.moneycontrol.com/forum-topics/stocks/asian-paints-262.html,,,,Asian Paints,Does anyone know when the results will be announced,0.0,neutral,0.0,0.0,1.0
https://mmb.moneycontrol.com/forum-topics/stocks/asian-paints-262.html,https://mmb.moneycontrol.com/forum-topics/stocks/asian-paints-262.html,,,,Asian Paints,Heavy buying seen inbetween 2850 to 2836 Expect it to move towards 3300 levels,0.0,neutral,0.0,0.0,1.0
https://mmb.moneycontrol.com/forum-topics/stocks/asian-paints-262.html,https://mmb.moneycontrol.com/forum-topics/stocks/asian-paints-262.html,,,,Asian Paints,Company expected to declare good results in December quarter due to festival season. Falling crude prices will be beneficial for the company. 10 to 15 percent upside expected.,0.0,neutral,0.0,0.0,1.0
https://mmb.moneycontrol.com/forum-topics/stocks/asian-paints-262.html,https://mmb.moneycontrol.com/forum-topics/stocks/asian-paints-262.html,,,,Asian Paints,asian paints target 3300 by 1-2months for good returns.,0.0,neutral,0.0,0.0,1.0
https://mmb.moneycontrol.com/forum-topics/stocks/asian-paints-262.html,https://mmb.moneycontrol.com/forum-topics/stocks/asian-paints-262.html,,,,Asian Paints,"crude oil is up 2 percent, firming up...",0.0,neutral,0.0,0.0,1.0
